[
  {
    "id": "scannet-plus-plus",
    "name": "ScanNet++",
    "kind": "dataset",
    "category": "datasets-benchmarks",
    "summary": "High-fidelity indoor dataset with DSLR, iPhone, panoramic, depth, mesh, pose, and semantic data plus Gaussian-ready conversion tools.",
    "year": 2023,
    "venue": "ICCV 2023 Oral",
    "paper_url": "https://arxiv.org/abs/2308.11417",
    "project_url": "https://kaldir.vc.in.tum.de/scannetpp/",
    "code_url": "https://github.com/scannetpp/scannetpp",
    "code_status": "released",
    "license": "Custom dataset terms",
    "inputs": ["multi-view-rgb", "rgb-d", "depth", "point-cloud"],
    "pose_requirement": "known-poses",
    "frameworks": ["pytorch", "open3d", "colmap", "custom"],
    "capabilities": ["reconstruction", "semantics", "instance-segmentation", "dataset", "benchmark"],
    "tags": ["dataset", "benchmark", "reconstruction", "semantics"],
    "verified_date": "2026-08-30",
    "sources": [
      "https://arxiv.org/abs/2308.11417",
      "https://github.com/scannetpp/scannetpp"
    ],
    "arxiv": "2308.11417",
    "featured": true
  },
  {
    "id": "dynamic-replica",
    "name": "Dynamic Replica",
    "kind": "dataset",
    "category": "datasets-benchmarks",
    "summary": "Synthetic dynamic stereo benchmark with calibrated cameras, depth, instance masks, foreground masks, optical flow, and long-range trajectories.",
    "year": 2023,
    "venue": "CVPR 2023",
    "paper_url": "https://arxiv.org/abs/2305.02296",
    "project_url": null,
    "code_url": "https://github.com/facebookresearch/dynamic_stereo",
    "code_status": "released",
    "license": "Custom dataset terms",
    "inputs": ["stereo-rgb", "depth"],
    "pose_requirement": "known-poses",
    "frameworks": ["pytorch", "cuda", "custom"],
    "capabilities": ["object-tracking", "dynamic", "dataset", "benchmark"],
    "tags": ["dataset", "benchmark", "dynamic-scene"],
    "verified_date": "2026-08-30",
    "sources": [
      "https://arxiv.org/abs/2305.02296",
      "https://github.com/facebookresearch/dynamic_stereo"
    ],
    "arxiv": "2305.02296",
    "featured": false
  },
  {
    "id": "nerf-3dgs-slam-wild-benchmark",
    "name": "NeRF and Gaussian Splatting SLAM in the Wild",
    "kind": "benchmark",
    "category": "datasets-benchmarks",
    "summary": "Dockerized outdoor benchmark evaluating traditional, neural, and Gaussian SLAM under lighting, seasonal, and dynamic environmental changes.",
    "year": 2024,
    "venue": "arXiv 2024",
    "paper_url": "https://arxiv.org/abs/2412.03263",
    "project_url": "https://iis-esslingen.github.io/rover/",
    "code_url": "https://github.com/iis-esslingen/nerf-3dgs-benchmark",
    "code_status": "partial",
    "license": "unknown",
    "inputs": ["monocular-rgb", "stereo-rgb", "rgb-d", "imu"],
    "pose_requirement": "known-poses",
    "frameworks": ["cuda", "ros", "custom"],
    "capabilities": ["camera-tracking", "pose-estimation", "dataset", "benchmark"],
    "tags": ["3dgs", "slam", "dataset", "benchmark", "dynamic-scene"],
    "verified_date": "2026-08-30",
    "sources": [
      "https://arxiv.org/abs/2412.03263",
      "https://github.com/iis-esslingen/nerf-3dgs-benchmark"
    ],
    "arxiv": "2412.03263",
    "featured": false
  },
  {
    "id": "slam-and-render",
    "name": "SLAM&Render",
    "kind": "dataset",
    "category": "datasets-benchmarks",
    "summary": "Robot-cell benchmark with synchronized RGB, depth, IMU, joint states, flange poses, motion-capture ground truth, and held-out trajectories.",
    "year": 2025,
    "venue": "arXiv 2025",
    "paper_url": "https://arxiv.org/abs/2504.13713",
    "project_url": "https://samuel-cerezo.github.io/SLAM&Render.html",
    "code_url": "https://github.com/samuel-cerezo/SLAM-Render",
    "code_status": "released",
    "license": "Custom; see LICENSE.md",
    "inputs": ["rgb-d", "imu", "robot-state"],
    "pose_requirement": "known-poses",
    "frameworks": ["custom"],
    "capabilities": ["camera-tracking", "pose-estimation", "reconstruction", "dataset", "benchmark", "rendering"],
    "tags": ["3dgs", "slam", "dataset", "benchmark", "reconstruction"],
    "verified_date": "2026-08-30",
    "sources": [
      "https://arxiv.org/abs/2504.13713",
      "https://github.com/samuel-cerezo/SLAM-Render"
    ],
    "arxiv": "2504.13713",
    "featured": false
  }
]
