[
  {
    "id": "langsplat",
    "name": "LangSplat",
    "kind": "method",
    "category": "semantic-perception",
    "summary": "Language-embedded Gaussian field using CLIP distillation, hierarchical SAM semantics, and a scene-specific autoencoder for open-vocabulary queries.",
    "year": 2024,
    "venue": "CVPR 2024 Highlight",
    "paper_url": "https://arxiv.org/abs/2312.16084",
    "project_url": "https://langsplat.github.io/",
    "code_url": "https://github.com/minghanqin/LangSplat",
    "code_status": "released",
    "license": "Custom; see LICENSE.md",
    "inputs": ["multi-view-rgb", "language"],
    "pose_requirement": "external-poses",
    "frameworks": ["pytorch", "cuda", "colmap"],
    "capabilities": ["semantics", "open-vocabulary", "instance-segmentation", "rendering"],
    "tags": ["3dgs", "semantics", "open-vocabulary", "language"],
    "verified_date": "2026-08-30",
    "sources": [
      "https://arxiv.org/abs/2312.16084",
      "https://github.com/minghanqin/LangSplat"
    ],
    "arxiv": "2312.16084",
    "featured": true
  },
  {
    "id": "legaussians",
    "name": "LEGaussians",
    "kind": "method",
    "category": "semantic-perception",
    "summary": "Memory-conscious language Gaussian representation using semantic feature quantization and multi-view embedding for real-time open-vocabulary scene queries.",
    "year": 2024,
    "venue": "CVPR 2024",
    "paper_url": "https://arxiv.org/abs/2311.18482",
    "project_url": "https://buaavrcg.github.io/LEGaussians/",
    "code_url": "https://github.com/buaavrcg/LEGaussians",
    "code_status": "released",
    "license": "MIT",
    "inputs": ["multi-view-rgb", "language"],
    "pose_requirement": "external-poses",
    "frameworks": ["pytorch", "cuda", "colmap"],
    "capabilities": ["semantics", "open-vocabulary", "instance-segmentation", "rendering"],
    "tags": ["3dgs", "semantics", "open-vocabulary", "language"],
    "verified_date": "2026-08-30",
    "sources": [
      "https://arxiv.org/abs/2311.18482",
      "https://github.com/buaavrcg/LEGaussians"
    ],
    "arxiv": "2311.18482",
    "featured": false
  },
  {
    "id": "feature-3dgs",
    "name": "Feature 3DGS",
    "kind": "method",
    "category": "semantic-perception",
    "summary": "General feature-field distillation for Gaussians supporting semantic segmentation, language-guided editing, and point or box prompted selection.",
    "year": 2024,
    "venue": "CVPR 2024 Highlight",
    "paper_url": "https://arxiv.org/abs/2312.03203",
    "project_url": null,
    "code_url": "https://github.com/ShijieZhou-UCLA/feature-3dgs",
    "code_status": "released",
    "license": "Custom; see LICENSE.md",
    "inputs": ["multi-view-rgb", "language"],
    "pose_requirement": "external-poses",
    "frameworks": ["pytorch", "cuda", "colmap"],
    "capabilities": ["semantics", "open-vocabulary", "instance-segmentation", "scene-editing", "rendering"],
    "tags": ["3dgs", "semantics", "open-vocabulary", "language"],
    "verified_date": "2026-08-30",
    "sources": [
      "https://arxiv.org/abs/2312.03203",
      "https://github.com/ShijieZhou-UCLA/feature-3dgs"
    ],
    "arxiv": "2312.03203",
    "featured": false
  },
  {
    "id": "opengaussian",
    "name": "OpenGaussian",
    "kind": "method",
    "category": "semantic-perception",
    "summary": "Point-level open-vocabulary Gaussian understanding with instance feature learning, codebook discretization, and language-to-cluster association.",
    "year": 2024,
    "venue": "NeurIPS 2024",
    "paper_url": "https://arxiv.org/abs/2406.02058",
    "project_url": "https://3d-aigc.github.io/OpenGaussian/",
    "code_url": "https://github.com/yanmin-wu/OpenGaussian",
    "code_status": "released",
    "license": "Custom; see LICENSE.md",
    "inputs": ["multi-view-rgb", "point-cloud", "language"],
    "pose_requirement": "external-poses",
    "frameworks": ["pytorch", "cuda", "colmap", "open3d"],
    "capabilities": ["semantics", "open-vocabulary", "instance-segmentation", "rendering"],
    "tags": ["3dgs", "semantics", "open-vocabulary", "language"],
    "verified_date": "2026-08-30",
    "sources": [
      "https://arxiv.org/abs/2406.02058",
      "https://github.com/yanmin-wu/OpenGaussian"
    ],
    "arxiv": "2406.02058",
    "featured": false
  },
  {
    "id": "gaussian-grouping",
    "name": "Gaussian Grouping",
    "kind": "method",
    "category": "semantic-perception",
    "summary": "Joint scene reconstruction and open-world grouping using SAM masks, compact identity encodings, and spatial consistency regularization.",
    "year": 2024,
    "venue": "ECCV 2024",
    "paper_url": "https://arxiv.org/abs/2312.00732",
    "project_url": null,
    "code_url": "https://github.com/lkeab/gaussian-grouping",
    "code_status": "released",
    "license": "Apache-2.0",
    "inputs": ["multi-view-rgb"],
    "pose_requirement": "external-poses",
    "frameworks": ["pytorch", "cuda", "colmap"],
    "capabilities": ["semantics", "instance-segmentation", "scene-editing", "rendering"],
    "tags": ["3dgs", "semantics"],
    "verified_date": "2026-08-30",
    "sources": [
      "https://arxiv.org/abs/2312.00732",
      "https://github.com/lkeab/gaussian-grouping"
    ],
    "arxiv": "2312.00732",
    "featured": false
  },
  {
    "id": "saga",
    "name": "SAGA",
    "kind": "method",
    "category": "semantic-perception",
    "summary": "Interactive and open-vocabulary Gaussian segmentation using contrastively learned affinity features with point prompts and CLIP queries.",
    "year": 2025,
    "venue": "AAAI 2025",
    "paper_url": "https://arxiv.org/abs/2312.00860",
    "project_url": null,
    "code_url": "https://github.com/Jumpat/SegAnyGAussians",
    "code_status": "released",
    "license": "Apache-2.0",
    "inputs": ["multi-view-rgb", "language"],
    "pose_requirement": "external-poses",
    "frameworks": ["pytorch", "cuda", "colmap"],
    "capabilities": ["semantics", "open-vocabulary", "instance-segmentation", "rendering"],
    "tags": ["3dgs", "semantics", "open-vocabulary", "language"],
    "verified_date": "2026-08-30",
    "sources": [
      "https://arxiv.org/abs/2312.00860",
      "https://github.com/Jumpat/SegAnyGAussians"
    ],
    "arxiv": "2312.00860",
    "featured": false
  },
  {
    "id": "fmgs",
    "name": "FMGS",
    "kind": "method",
    "category": "semantic-perception",
    "summary": "Foundation-model semantic field combining 3D Gaussians with multi-resolution hash encodings for object queries and unsupervised segmentation.",
    "year": 2024,
    "venue": "arXiv 2024",
    "paper_url": "https://arxiv.org/abs/2401.01970",
    "project_url": "https://xingxingzuo.github.io/fmgs/",
    "code_url": "https://github.com/google-research/foundation-model-embedded-3dgs",
    "code_status": "released",
    "license": "Apache-2.0",
    "inputs": ["multi-view-rgb", "language"],
    "pose_requirement": "external-poses",
    "frameworks": ["pytorch", "cuda", "colmap"],
    "capabilities": ["semantics", "open-vocabulary", "instance-segmentation", "rendering"],
    "tags": ["3dgs", "semantics", "open-vocabulary", "language"],
    "verified_date": "2026-08-30",
    "sources": [
      "https://arxiv.org/abs/2401.01970",
      "https://github.com/google-research/foundation-model-embedded-3dgs"
    ],
    "arxiv": "2401.01970",
    "featured": false
  },
  {
    "id": "semantic-gaussians",
    "name": "Semantic Gaussians",
    "kind": "method",
    "category": "semantic-perception",
    "summary": "Open-vocabulary scene understanding by projecting diverse 2D semantic features onto Gaussians and distilling a sparse 3D semantic network.",
    "year": 2024,
    "venue": "arXiv 2024",
    "paper_url": "https://arxiv.org/abs/2403.15624",
    "project_url": "https://sharinka0715.github.io/semantic-gaussians/",
    "code_url": "https://github.com/sharinka0715/semantic-gaussians",
    "code_status": "released",
    "license": "MIT",
    "inputs": ["multi-view-rgb", "point-cloud", "language"],
    "pose_requirement": "external-poses",
    "frameworks": ["pytorch", "cuda", "open3d"],
    "capabilities": ["semantics", "open-vocabulary", "instance-segmentation", "rendering"],
    "tags": ["3dgs", "semantics", "open-vocabulary", "language"],
    "verified_date": "2026-08-30",
    "sources": [
      "https://arxiv.org/abs/2403.15624",
      "https://github.com/sharinka0715/semantic-gaussians"
    ],
    "arxiv": "2403.15624",
    "featured": false
  }
]
