[
  {
    "id": "splat-nav",
    "name": "Splat-Nav",
    "kind": "system",
    "category": "navigation-planning",
    "summary": "Robot navigation stack combining collision-aware trajectory corridors with RGB localization directly against prebuilt Gaussian maps.",
    "year": 2024,
    "venue": "arXiv 2024",
    "paper_url": "https://arxiv.org/abs/2403.02751",
    "project_url": null,
    "code_url": "https://github.com/chengine/splatnav",
    "code_status": "released",
    "license": "MIT",
    "inputs": ["monocular-rgb", "point-cloud"],
    "pose_requirement": "estimated-online",
    "frameworks": ["pytorch", "cuda", "ros", "nerfstudio", "custom"],
    "capabilities": ["pose-estimation", "relocalization", "planning", "navigation", "free-space", "collision-checking"],
    "tags": ["3dgs", "navigation", "path-planning", "mobile-robot"],
    "verified_date": "2026-08-30",
    "sources": [
      "https://arxiv.org/abs/2403.02751",
      "https://github.com/chengine/splatnav"
    ],
    "arxiv": "2403.02751",
    "featured": true
  },
  {
    "id": "gaussnav",
    "name": "GaussNav",
    "kind": "system",
    "category": "navigation-planning",
    "summary": "Habitat pipeline for frontier exploration, semantic Gaussian construction, object matching, grid conversion, and ImageGoal navigation experiments.",
    "year": 2024,
    "venue": "arXiv 2024",
    "paper_url": "https://arxiv.org/abs/2403.11625",
    "project_url": "https://xiaohanlei.github.io/projects/GaussNav/",
    "code_url": "https://github.com/XiaohanLei/GaussNav",
    "code_status": "partial",
    "license": "unknown",
    "inputs": ["rgb-d"],
    "pose_requirement": "known-poses",
    "frameworks": ["pytorch", "cuda", "habitat"],
    "capabilities": ["dense-mapping", "semantics", "instance-segmentation", "planning", "navigation"],
    "tags": ["3dgs", "navigation", "path-planning", "semantics", "mobile-robot"],
    "verified_date": "2026-08-30",
    "sources": [
      "https://arxiv.org/abs/2403.11625",
      "https://github.com/XiaohanLei/GaussNav"
    ],
    "arxiv": "2403.11625",
    "featured": false
  },
  {
    "id": "activegs",
    "name": "ActiveGS",
    "kind": "system",
    "category": "navigation-planning",
    "summary": "Active RGB-D reconstruction system using Gaussian confidence and a voxel map to select informative collision-free viewpoints.",
    "year": 2025,
    "venue": "IEEE RA-L 2025",
    "paper_url": "https://arxiv.org/abs/2412.17769",
    "project_url": null,
    "code_url": "https://github.com/dmar-bonn/active-gs",
    "code_status": "released",
    "license": "MIT",
    "inputs": ["rgb-d"],
    "pose_requirement": "external-poses",
    "frameworks": ["pytorch", "cuda", "open3d"],
    "capabilities": ["dense-mapping", "reconstruction", "online", "planning", "navigation", "free-space", "collision-checking", "rendering"],
    "tags": ["3dgs", "navigation", "path-planning", "reconstruction", "mobile-robot"],
    "verified_date": "2026-08-30",
    "sources": [
      "https://arxiv.org/abs/2412.17769",
      "https://github.com/dmar-bonn/active-gs"
    ],
    "doi": "10.1109/LRA.2025.3555149",
    "arxiv": "2412.17769",
    "featured": false
  },
  {
    "id": "activesplat",
    "name": "ActiveSplat",
    "kind": "system",
    "category": "navigation-planning",
    "summary": "Autonomous Gaussian reconstruction with sparse topology, view-dependent utility prediction, hierarchical viewpoint selection, and path planning.",
    "year": 2025,
    "venue": "IEEE RA-L 2025",
    "paper_url": "https://arxiv.org/abs/2410.21955",
    "project_url": "https://li-yuetao.github.io/ActiveSplat/",
    "code_url": "https://github.com/Li-Yuetao/ActiveSplat",
    "code_status": "released",
    "license": "MIT",
    "inputs": ["rgb-d"],
    "pose_requirement": "external-poses",
    "frameworks": ["pytorch", "cuda", "ros2", "habitat"],
    "capabilities": ["dense-mapping", "reconstruction", "online", "planning", "navigation", "free-space", "collision-checking", "rendering"],
    "tags": ["3dgs", "navigation", "path-planning", "reconstruction", "mobile-robot"],
    "verified_date": "2026-08-30",
    "sources": [
      "https://arxiv.org/abs/2410.21955",
      "https://github.com/Li-Yuetao/ActiveSplat"
    ],
    "doi": "10.1109/LRA.2025.3580331",
    "arxiv": "2410.21955",
    "featured": false
  },
  {
    "id": "vista-semantic-splatbridge",
    "name": "VISTA / Semantic-SplatBridge",
    "kind": "system",
    "category": "navigation-planning",
    "summary": "ROS2 semantic Gaussian mapping bridge supporting VISTA's open-vocabulary, task-relevant exploration from live image, depth, and pose topics.",
    "year": 2025,
    "venue": "arXiv 2025",
    "paper_url": "https://arxiv.org/abs/2507.01125",
    "project_url": "https://stanfordmsl.github.io/VISTA/",
    "code_url": "https://github.com/StanfordMSL/Semantic-SplatBridge",
    "code_status": "partial",
    "license": "MIT",
    "inputs": ["monocular-rgb", "depth", "language"],
    "pose_requirement": "external-poses",
    "frameworks": ["pytorch", "cuda", "ros2", "nerfstudio", "gsplat"],
    "capabilities": ["dense-mapping", "online", "semantics", "open-vocabulary", "planning", "navigation", "free-space"],
    "tags": ["3dgs", "navigation", "path-planning", "semantics", "open-vocabulary", "mobile-robot"],
    "verified_date": "2026-08-30",
    "sources": [
      "https://arxiv.org/abs/2507.01125",
      "https://github.com/StanfordMSL/Semantic-SplatBridge"
    ],
    "arxiv": "2507.01125",
    "featured": false
  }
]
