[
  {
    "id": "gaussian-world-model",
    "name": "Gaussian World Model",
    "kind": "method",
    "category": "robot-learning-vla",
    "summary": "Action-conditioned latent diffusion world model that predicts future 3D Gaussian states for imitation learning and model-based reinforcement learning.",
    "year": 2025,
    "venue": "ICCV 2025",
    "paper_url": "https://arxiv.org/abs/2508.17600",
    "project_url": "https://gaussian-world-model.github.io/",
    "code_url": "https://github.com/Gaussian-World-Model/gaussianwm",
    "code_status": "partial",
    "license": "MIT",
    "inputs": ["monocular-rgb", "multi-view-rgb", "robot-state"],
    "pose_requirement": "not-applicable",
    "frameworks": ["pytorch", "cuda", "custom"],
    "capabilities": ["reconstruction", "simulation", "manipulation", "policy-learning"],
    "tags": ["3dgs", "manipulation", "robot-learning"],
    "verified_date": "2026-08-30",
    "sources": [
      "https://arxiv.org/abs/2508.17600",
      "https://gaussian-world-model.github.io/",
      "https://github.com/Gaussian-World-Model/gaussianwm"
    ],
    "arxiv": "2508.17600",
    "featured": true
  },
  {
    "id": "robogsim",
    "name": "RoboGSim",
    "kind": "simulator",
    "category": "robot-learning-vla",
    "summary": "Real2Sim2Real simulator that combines Gaussian reconstruction, digital twins, scene composition, and closed-loop policy evaluation for robot manipulation.",
    "year": 2024,
    "venue": "arXiv 2024",
    "paper_url": "https://arxiv.org/abs/2411.11839",
    "project_url": "https://robogsim.github.io/",
    "code_url": null,
    "code_status": "unavailable",
    "license": "unknown",
    "inputs": ["multi-view-rgb", "robot-state", "simulation-state"],
    "pose_requirement": "unknown",
    "frameworks": ["isaac-sim"],
    "capabilities": ["reconstruction", "rendering", "simulation", "real-to-sim", "manipulation", "policy-learning", "vla"],
    "tags": ["3dgs", "real-to-sim", "sim-to-real", "manipulation", "robot-learning", "vla"],
    "verified_date": "2026-08-30",
    "sources": [
      "https://arxiv.org/abs/2411.11839",
      "https://robogsim.github.io/"
    ],
    "arxiv": "2411.11839",
    "featured": false
  },
  {
    "id": "rl-gsbridge",
    "name": "RL-GSBridge",
    "kind": "system",
    "category": "robot-learning-vla",
    "summary": "Real2Sim2Real reinforcement-learning pipeline using mesh-bound Gaussians and synchronized physics rendering for zero-shot manipulation transfer.",
    "year": 2025,
    "venue": "ICRA 2025",
    "paper_url": "https://arxiv.org/abs/2409.20291",
    "project_url": null,
    "code_url": "https://github.com/IRMV-Manipulation-Group/RL-GSBridge",
    "code_status": "partial",
    "license": "GPL-3.0",
    "inputs": ["multi-view-rgb", "robot-state", "simulation-state"],
    "pose_requirement": "unknown",
    "frameworks": ["pytorch", "cuda", "custom", "colmap"],
    "capabilities": ["reconstruction", "rendering", "simulation", "real-to-sim", "manipulation", "policy-learning"],
    "tags": ["3dgs", "real-to-sim", "sim-to-real", "manipulation", "robot-learning"],
    "verified_date": "2026-08-30",
    "sources": [
      "https://arxiv.org/abs/2409.20291",
      "https://github.com/IRMV-Manipulation-Group/RL-GSBridge",
      "https://doi.org/10.1109/ICRA55743.2025.11128103"
    ],
    "doi": "10.1109/ICRA55743.2025.11128103",
    "arxiv": "2409.20291",
    "featured": false
  },
  {
    "id": "legs-vla",
    "name": "LEGS",
    "kind": "simulator",
    "category": "robot-learning-vla",
    "summary": "Teleoperation-free humanoid VLA adaptation using procedural MuJoCo demonstrations composited over calibrated Gaussian-splatted deployment environments.",
    "year": 2026,
    "venue": "arXiv 2026",
    "paper_url": "https://arxiv.org/abs/2606.01458",
    "project_url": "https://legsvla.github.io/",
    "code_url": null,
    "code_status": "unavailable",
    "license": "unknown",
    "inputs": ["multi-view-rgb", "language", "robot-state", "simulation-state"],
    "pose_requirement": "unknown",
    "frameworks": ["mujoco"],
    "capabilities": ["rendering", "simulation", "real-to-sim", "manipulation", "policy-learning", "vla"],
    "tags": ["3dgs", "real-to-sim", "sim-to-real", "manipulation", "robot-learning", "vla"],
    "verified_date": "2026-08-30",
    "sources": [
      "https://arxiv.org/abs/2606.01458",
      "https://legsvla.github.io/"
    ],
    "arxiv": "2606.01458",
    "featured": false
  },
  {
    "id": "gaussiandream",
    "name": "GaussianDream",
    "kind": "method",
    "category": "robot-learning-vla",
    "summary": "Feed-forward Gaussian world-model plug-in that adds current-scene reconstruction and future-state supervision to vision-language-action policy training.",
    "year": 2026,
    "venue": "arXiv 2026",
    "paper_url": "https://arxiv.org/abs/2605.20752",
    "project_url": null,
    "code_url": "https://github.com/TuojingAI/GaussianDream",
    "code_status": "released",
    "license": "Apache-2.0",
    "inputs": ["multi-view-rgb", "language", "robot-state"],
    "pose_requirement": "unknown",
    "frameworks": ["pytorch", "cuda", "custom"],
    "capabilities": ["reconstruction", "manipulation", "policy-learning", "vla"],
    "tags": ["3dgs", "language", "manipulation", "robot-learning", "vla"],
    "verified_date": "2026-08-30",
    "sources": [
      "https://arxiv.org/abs/2605.20752",
      "https://github.com/TuojingAI/GaussianDream"
    ],
    "arxiv": "2605.20752",
    "featured": false
  },
  {
    "id": "h2rh-sgs",
    "name": "H2RH-SGS",
    "kind": "method",
    "category": "robot-learning-vla",
    "summary": "Supervised handover policy trained from synthetic image-action demonstrations rendered inside metric sparse-view Gaussian reconstructions of human-object scenes.",
    "year": 2025,
    "venue": "arXiv 2025",
    "paper_url": "https://arxiv.org/abs/2507.08726",
    "project_url": null,
    "code_url": null,
    "code_status": "paper-only",
    "license": "unknown",
    "inputs": ["monocular-rgb", "rgb-d", "robot-state"],
    "pose_requirement": "unknown",
    "frameworks": ["unknown"],
    "capabilities": ["reconstruction", "grasping", "manipulation", "real-to-sim", "policy-learning"],
    "tags": ["3dgs", "human-robot-interaction", "grasping", "manipulation", "real-to-sim", "robot-learning"],
    "verified_date": "2026-08-30",
    "sources": [
      "https://arxiv.org/abs/2507.08726"
    ],
    "arxiv": "2507.08726",
    "featured": false
  },
  {
    "id": "gaussian-splatted-foresight",
    "name": "Gaussian-Splatted Foresight",
    "kind": "method",
    "category": "robot-learning-vla",
    "summary": "Foresight module that predicts action-conditioned future Gaussians, detects execution failures from scene mismatch, and rolls back unsafe manipulation actions.",
    "year": 2025,
    "venue": "AAAI 2025",
    "paper_url": "https://ojs.aaai.org/index.php/AAAI/article/view/34866",
    "project_url": null,
    "code_url": null,
    "code_status": "paper-only",
    "license": "unknown",
    "inputs": ["rgb-d", "language", "robot-state"],
    "pose_requirement": "not-applicable",
    "frameworks": ["unknown"],
    "capabilities": ["reconstruction", "grasping", "manipulation", "policy-learning"],
    "tags": ["3dgs", "language", "grasping", "manipulation", "robot-learning"],
    "verified_date": "2026-08-30",
    "sources": [
      "https://ojs.aaai.org/index.php/AAAI/article/view/34866",
      "https://doi.org/10.1609/aaai.v39i25.34866"
    ],
    "doi": "10.1609/aaai.v39i25.34866",
    "featured": false
  }
]
