[
  {
    "id": "gsfusion",
    "name": "GSFusion",
    "kind": "system",
    "category": "mapping-reconstruction",
    "summary": "Online RGB-D mapper coupling a compact Gaussian appearance map with TSDF fusion for geometrically consistent reconstruction and immediate feedback.",
    "year": 2024,
    "venue": "IEEE RA-L 2024",
    "paper_url": "https://arxiv.org/abs/2408.12677",
    "project_url": "https://gs-fusion.github.io/",
    "code_url": "https://github.com/ethz-mrl/GSFusion",
    "code_status": "released",
    "license": "BSD-3-Clause with non-commercial Inria-3DGS components",
    "inputs": ["rgb-d"],
    "pose_requirement": "external-poses",
    "frameworks": ["pytorch", "cuda", "open3d", "custom"],
    "capabilities": ["dense-mapping", "reconstruction", "online", "rendering"],
    "tags": ["3dgs", "reconstruction"],
    "verified_date": "2026-08-30",
    "sources": [
      "https://arxiv.org/abs/2408.12677",
      "https://gs-fusion.github.io/",
      "https://github.com/ethz-mrl/GSFusion",
      "https://doi.org/10.1109/LRA.2024.3502065"
    ],
    "doi": "10.1109/LRA.2024.3502065",
    "arxiv": "2408.12677",
    "featured": true
  },
  {
    "id": "3d-gaussian-mapping",
    "name": "3D Gaussian Mapping",
    "kind": "method",
    "category": "mapping-reconstruction",
    "summary": "Self-supervised camera-only mapping from repeated driving traversals that reconstructs persistent Gaussian environments while segmenting ephemeral objects.",
    "year": 2024,
    "venue": "NeurIPS 2024 Spotlight",
    "paper_url": "https://arxiv.org/abs/2405.17187",
    "project_url": "https://nvlabs.github.io/3DGM/",
    "code_url": "https://github.com/NVlabs/3DGM",
    "code_status": "unavailable",
    "license": "unknown",
    "inputs": ["multi-view-rgb"],
    "pose_requirement": "unknown",
    "frameworks": ["unknown"],
    "capabilities": ["dense-mapping", "reconstruction", "semantics", "rendering"],
    "tags": ["3dgs", "reconstruction", "semantics", "mobile-robot"],
    "verified_date": "2026-08-30",
    "sources": [
      "https://arxiv.org/abs/2405.17187",
      "https://nvlabs.github.io/3DGM/",
      "https://github.com/NVlabs/3DGM",
      "https://proceedings.neurips.cc/paper_files/paper/2024/hash/c402501846f9fe03e2cac015b3f0e6b1-Abstract-Conference.html"
    ],
    "arxiv": "2405.17187",
    "featured": false
  },
  {
    "id": "multi-robot-autonomous-reconstruction",
    "name": "Multi-Robot Autonomous 3D Reconstruction",
    "kind": "system",
    "category": "mapping-reconstruction",
    "summary": "Centralized multi-robot Gaussian reconstruction with open-vocabulary instance uncertainty, collaborative task assignment, and hierarchical view-path planning.",
    "year": 2025,
    "venue": "IEEE RA-L 2025",
    "paper_url": "https://arxiv.org/abs/2412.02249",
    "project_url": null,
    "code_url": null,
    "code_status": "paper-only",
    "license": "unknown",
    "inputs": ["rgb-d"],
    "pose_requirement": "external-poses",
    "frameworks": ["unknown"],
    "capabilities": ["dense-mapping", "reconstruction", "semantics", "open-vocabulary", "planning", "multi-robot", "rendering"],
    "tags": ["3dgs", "reconstruction", "open-vocabulary", "semantics", "path-planning", "multi-robot"],
    "verified_date": "2026-08-30",
    "sources": [
      "https://arxiv.org/abs/2412.02249",
      "https://doi.org/10.1109/LRA.2025.3558703"
    ],
    "doi": "10.1109/LRA.2025.3558703",
    "arxiv": "2412.02249",
    "featured": false
  },
  {
    "id": "gs-livm",
    "name": "GS-LIVM",
    "kind": "system",
    "category": "mapping-reconstruction",
    "summary": "Real-time LiDAR-inertial-visual mapper using voxel Gaussian-process regression and custom splatting kernels for photorealistic large-scale outdoor reconstruction.",
    "year": 2025,
    "venue": "ICCV 2025",
    "paper_url": "https://openaccess.thecvf.com/content/ICCV2025/html/Xie_GS-LIVM_Real-Time_Photo-Realistic_LiDAR-Inertial-Visual_Mapping_with_Gaussian_Splatting_ICCV_2025_paper.html",
    "project_url": null,
    "code_url": "https://github.com/xieyuser/GS-LIVM",
    "code_status": "released",
    "license": "GPL-3.0",
    "inputs": ["multi-view-rgb", "lidar", "imu"],
    "pose_requirement": "estimated-online",
    "frameworks": ["pytorch", "cuda", "ros", "custom"],
    "capabilities": ["pose-estimation", "dense-mapping", "reconstruction", "online", "lidar-mapping", "rendering"],
    "tags": ["3dgs", "reconstruction", "mobile-robot"],
    "verified_date": "2026-08-30",
    "sources": [
      "https://arxiv.org/abs/2410.17084",
      "https://openaccess.thecvf.com/content/ICCV2025/html/Xie_GS-LIVM_Real-Time_Photo-Realistic_LiDAR-Inertial-Visual_Mapping_with_Gaussian_Splatting_ICCV_2025_paper.html",
      "https://github.com/xieyuser/GS-LIVM"
    ],
    "arxiv": "2410.17084",
    "featured": false
  },
  {
    "id": "mtgs",
    "name": "MTGS",
    "kind": "method",
    "category": "mapping-reconstruction",
    "summary": "Multi-traversal driving-scene reconstruction with shared static geometry, traversal-specific dynamics, appearance correction, and LiDAR-guided geometric supervision.",
    "year": 2025,
    "venue": "arXiv 2025",
    "paper_url": "https://arxiv.org/abs/2503.12552",
    "project_url": null,
    "code_url": "https://github.com/OpenDriveLab/MTGS",
    "code_status": "released",
    "license": "Apache-2.0; released data is CC-BY-NC-SA-4.0",
    "inputs": ["multi-view-rgb", "lidar"],
    "pose_requirement": "known-poses",
    "frameworks": ["pytorch", "cuda", "colmap", "custom"],
    "capabilities": ["dense-mapping", "reconstruction", "lidar-mapping", "dynamic", "rendering"],
    "tags": ["3dgs", "reconstruction", "dynamic-scene"],
    "verified_date": "2026-08-30",
    "sources": [
      "https://arxiv.org/abs/2503.12552",
      "https://github.com/OpenDriveLab/MTGS"
    ],
    "arxiv": "2503.12552",
    "featured": false
  }
]
