[
  {
    "id": "splatsim",
    "name": "SplatSim",
    "kind": "simulator",
    "category": "simulation-digital-twins",
    "summary": "Gaussian renderer layered over a physics simulator for generating photorealistic manipulation demonstrations and zero-shot RGB policy transfer.",
    "year": 2025,
    "venue": "ICRA 2025",
    "paper_url": "https://arxiv.org/abs/2409.10161",
    "project_url": "https://splatsim.github.io/",
    "code_url": "https://github.com/qureshinomaan/SplatSim",
    "code_status": "released",
    "license": "unknown",
    "inputs": ["multi-view-rgb", "robot-state", "simulation-state"],
    "pose_requirement": "external-poses",
    "frameworks": ["pytorch", "cuda", "colmap", "custom"],
    "capabilities": ["manipulation", "real-to-sim", "simulation", "policy-learning", "rendering"],
    "tags": ["3dgs", "real-to-sim", "sim-to-real", "manipulation", "robot-learning"],
    "verified_date": "2026-08-30",
    "sources": [
      "https://arxiv.org/abs/2409.10161",
      "https://github.com/qureshinomaan/SplatSim"
    ],
    "arxiv": "2409.10161",
    "featured": true
  },
  {
    "id": "robosimgs",
    "name": "RoboSimGS",
    "kind": "system",
    "category": "simulation-digital-twins",
    "summary": "Real-to-sim-to-real pipeline combining Gaussian scene appearance, mesh-based interactions, automated articulation inference, data generation, and policy deployment.",
    "year": 2025,
    "venue": "arXiv 2025",
    "paper_url": "https://arxiv.org/abs/2510.10637",
    "project_url": null,
    "code_url": "https://github.com/Maxwell-Zhao/RoboSimGS",
    "code_status": "partial",
    "license": "MIT",
    "inputs": ["multi-view-rgb", "language", "robot-state", "simulation-state"],
    "pose_requirement": "external-poses",
    "frameworks": ["pytorch", "cuda", "nerfstudio", "custom"],
    "capabilities": ["manipulation", "real-to-sim", "simulation", "policy-learning", "scene-editing", "rendering"],
    "tags": ["3dgs", "real-to-sim", "sim-to-real", "manipulation", "robot-learning"],
    "verified_date": "2026-08-30",
    "sources": [
      "https://arxiv.org/abs/2510.10637",
      "https://github.com/Maxwell-Zhao/RoboSimGS"
    ],
    "arxiv": "2510.10637",
    "featured": false
  },
  {
    "id": "re3sim",
    "name": "Re3Sim",
    "kind": "system",
    "category": "simulation-digital-twins",
    "summary": "Photorealistic real-to-sim workflow for reconstructing custom robot workspaces, calibrating them into Isaac Sim, and collecting imitation data.",
    "year": 2026,
    "venue": "ICRA 2026",
    "paper_url": "https://arxiv.org/abs/2502.08645",
    "project_url": "https://xshenhan.github.io/Re3Sim/",
    "code_url": "https://github.com/InternRobotics/Re3Sim",
    "code_status": "released",
    "license": "CC-BY-NC-4.0",
    "inputs": ["multi-view-rgb", "robot-state", "simulation-state"],
    "pose_requirement": "external-poses",
    "frameworks": ["pytorch", "cuda", "isaac-sim", "colmap", "custom"],
    "capabilities": ["manipulation", "real-to-sim", "simulation", "policy-learning", "rendering"],
    "tags": ["3dgs", "real-to-sim", "sim-to-real", "manipulation", "robot-learning"],
    "verified_date": "2026-08-30",
    "sources": [
      "https://arxiv.org/abs/2502.08645",
      "https://github.com/InternRobotics/Re3Sim"
    ],
    "arxiv": "2502.08645",
    "featured": false
  },
  {
    "id": "x-sim",
    "name": "X-Sim",
    "kind": "system",
    "category": "simulation-digital-twins",
    "summary": "Cross-embodiment pipeline that converts RGB-D human demonstrations into photorealistic simulation rewards, synthetic rollouts, and deployable robot policies.",
    "year": 2025,
    "venue": "arXiv 2025",
    "paper_url": "https://arxiv.org/abs/2505.07096",
    "project_url": "https://portal-cornell.github.io/X-Sim/",
    "code_url": "https://github.com/portal-cornell/X-Sim",
    "code_status": "released",
    "license": "unknown",
    "inputs": ["rgb-d", "robot-state", "simulation-state"],
    "pose_requirement": "external-poses",
    "frameworks": ["pytorch", "cuda", "custom"],
    "capabilities": ["manipulation", "real-to-sim", "simulation", "policy-learning", "rendering"],
    "tags": ["3dgs", "real-to-sim", "sim-to-real", "manipulation", "robot-learning"],
    "verified_date": "2026-08-30",
    "sources": [
      "https://arxiv.org/abs/2505.07096",
      "https://github.com/portal-cornell/X-Sim"
    ],
    "arxiv": "2505.07096",
    "featured": false
  },
  {
    "id": "real2sim-policy-eval",
    "name": "Real-to-Sim Policy Evaluation",
    "kind": "simulator",
    "category": "simulation-digital-twins",
    "summary": "Policy-evaluation environment combining Gaussian scans with physics-informed deformable twins for reproducible soft-body manipulation rollouts.",
    "year": 2025,
    "venue": "arXiv 2025",
    "paper_url": "https://arxiv.org/abs/2511.04665",
    "project_url": "https://real2sim-eval.github.io/",
    "code_url": "https://github.com/kywind/real2sim-eval",
    "code_status": "released",
    "license": "MIT",
    "inputs": ["point-cloud", "robot-state", "simulation-state"],
    "pose_requirement": "external-poses",
    "frameworks": ["pytorch", "cuda", "custom"],
    "capabilities": ["manipulation", "real-to-sim", "simulation", "policy-learning", "dynamic", "deformation", "rendering"],
    "tags": ["3dgs", "real-to-sim", "manipulation", "robot-learning", "dynamic-scene"],
    "verified_date": "2026-08-30",
    "sources": [
      "https://arxiv.org/abs/2511.04665",
      "https://github.com/kywind/real2sim-eval"
    ],
    "arxiv": "2511.04665",
    "featured": false
  }
]
