[
  {
    "id": "inria-3dgs",
    "name": "3D Gaussian Splatting Reference Implementation",
    "kind": "library",
    "category": "deployment-tooling",
    "summary": "Original training, rasterization, conversion, and interactive viewer implementation accompanying the foundational 3D Gaussian Splatting paper.",
    "year": 2023,
    "venue": "SIGGRAPH 2023",
    "paper_url": "https://arxiv.org/abs/2308.04079",
    "project_url": "https://repo-sam.inria.fr/fungraph/3d-gaussian-splatting/",
    "code_url": "https://github.com/graphdeco-inria/gaussian-splatting",
    "code_status": "released",
    "license": "Custom research and evaluation license",
    "inputs": ["multi-view-rgb", "point-cloud"],
    "pose_requirement": "external-poses",
    "frameworks": ["pytorch", "cuda", "colmap", "custom"],
    "capabilities": ["reconstruction", "rendering"],
    "tags": ["3dgs", "reconstruction", "tooling"],
    "verified_date": "2026-08-30",
    "sources": [
      "https://arxiv.org/abs/2308.04079",
      "https://github.com/graphdeco-inria/gaussian-splatting"
    ],
    "arxiv": "2308.04079",
    "featured": false
  },
  {
    "id": "gsplat",
    "name": "gsplat",
    "kind": "library",
    "category": "deployment-tooling",
    "summary": "Actively maintained PyTorch library providing CUDA-accelerated Gaussian rasterization, optimized training strategies, batching, distributed execution, and examples.",
    "year": 2025,
    "venue": "JMLR 2025",
    "paper_url": "https://arxiv.org/abs/2409.06765",
    "project_url": "https://docs.gsplat.studio/",
    "code_url": "https://github.com/nerfstudio-project/gsplat",
    "code_status": "released",
    "license": "Apache-2.0",
    "inputs": ["point-cloud"],
    "pose_requirement": "known-poses",
    "frameworks": ["pytorch", "cuda", "gsplat"],
    "capabilities": ["compression", "rendering"],
    "tags": ["3dgs", "compression", "tooling"],
    "verified_date": "2026-08-30",
    "sources": [
      "https://arxiv.org/abs/2409.06765",
      "https://github.com/nerfstudio-project/gsplat"
    ],
    "arxiv": "2409.06765",
    "featured": true
  },
  {
    "id": "nerfstudio-splatfacto",
    "name": "Nerfstudio Splatfacto",
    "kind": "library",
    "category": "deployment-tooling",
    "summary": "Modular capture-to-training toolkit with data processing, browser visualization, exports, plugins, and a gsplat-backed Gaussian implementation.",
    "year": 2023,
    "venue": "SIGGRAPH 2023",
    "paper_url": "https://arxiv.org/abs/2302.04264",
    "project_url": "https://docs.nerf.studio/nerfology/methods/splat.html",
    "code_url": "https://github.com/nerfstudio-project/nerfstudio",
    "code_status": "released",
    "license": "Apache-2.0",
    "inputs": ["multi-view-rgb", "depth"],
    "pose_requirement": "optional",
    "frameworks": ["pytorch", "cuda", "nerfstudio", "gsplat", "colmap"],
    "capabilities": ["reconstruction", "compression", "rendering", "scene-editing"],
    "tags": ["3dgs", "reconstruction", "compression", "tooling"],
    "verified_date": "2026-08-30",
    "sources": [
      "https://arxiv.org/abs/2302.04264",
      "https://github.com/nerfstudio-project/nerfstudio",
      "https://docs.nerf.studio/nerfology/methods/splat.html"
    ],
    "arxiv": "2302.04264",
    "featured": false
  },
  {
    "id": "opensplat",
    "name": "OpenSplat",
    "kind": "tool",
    "category": "deployment-tooling",
    "summary": "Portable C++ Gaussian trainer supporting COLMAP, OpenSfM, OpenMVG, ODM, and Nerfstudio projects across CPU and multiple GPU backends.",
    "year": 2024,
    "venue": "Open-source project",
    "paper_url": null,
    "project_url": null,
    "code_url": "https://github.com/pierotofy/OpenSplat",
    "code_status": "released",
    "license": "AGPL-3.0",
    "inputs": ["multi-view-rgb", "point-cloud"],
    "pose_requirement": "external-poses",
    "frameworks": ["colmap", "custom"],
    "capabilities": ["reconstruction", "rendering"],
    "tags": ["3dgs", "reconstruction", "tooling"],
    "verified_date": "2026-08-30",
    "sources": ["https://github.com/pierotofy/OpenSplat"],
    "featured": false
  },
  {
    "id": "supersplat",
    "name": "SuperSplat",
    "kind": "tool",
    "category": "deployment-tooling",
    "summary": "Browser-based editor for inspecting, cleaning, transforming, optimizing, animating, exporting, and self-hosting Gaussian splat scenes.",
    "year": 2024,
    "venue": "Open-source project",
    "paper_url": null,
    "project_url": "https://superspl.at/editor",
    "code_url": "https://github.com/playcanvas/supersplat",
    "code_status": "released",
    "license": "MIT",
    "inputs": ["point-cloud"],
    "pose_requirement": "not-applicable",
    "frameworks": ["custom"],
    "capabilities": ["compression", "rendering", "scene-editing"],
    "tags": ["3dgs", "compression", "tooling"],
    "verified_date": "2026-08-30",
    "sources": [
      "https://github.com/playcanvas/supersplat",
      "https://developer.playcanvas.com/user-manual/supersplat/"
    ],
    "featured": false
  },
  {
    "id": "3dgrut",
    "name": "3DGRUT",
    "kind": "library",
    "category": "deployment-tooling",
    "summary": "NVIDIA reconstruction and rendering stack combining Gaussian ray tracing and distortion-aware unscented-transform rasterization for complex cameras.",
    "year": 2025,
    "venue": "CVPR 2025 Oral",
    "paper_url": "https://arxiv.org/abs/2412.12507",
    "project_url": "https://research.nvidia.com/labs/toronto-ai/3DGUT/",
    "code_url": "https://github.com/nv-tlabs/3dgrut",
    "code_status": "released",
    "license": "Apache-2.0",
    "inputs": ["multi-view-rgb", "point-cloud"],
    "pose_requirement": "external-poses",
    "frameworks": ["pytorch", "cuda", "colmap", "custom"],
    "capabilities": ["reconstruction", "rendering"],
    "tags": ["3dgs", "reconstruction", "tooling"],
    "verified_date": "2026-08-30",
    "sources": [
      "https://arxiv.org/abs/2412.12507",
      "https://github.com/nv-tlabs/3dgrut"
    ],
    "arxiv": "2412.12507",
    "featured": false
  }
]
