[
  {
    "id": "manigaussian",
    "name": "ManiGaussian",
    "kind": "system",
    "category": "manipulation-interaction",
    "summary": "Language-conditioned behavior-cloning agent that models manipulation scenes and predicted dynamics with semantic dynamic Gaussian representations.",
    "year": 2024,
    "venue": "ECCV 2024",
    "paper_url": "https://arxiv.org/abs/2403.08321",
    "project_url": "https://guanxinglu.github.io/ManiGaussian/",
    "code_url": "https://github.com/GuanxingLu/ManiGaussian",
    "code_status": "released",
    "license": "MIT",
    "inputs": ["multi-view-rgb", "depth", "language", "robot-state", "simulation-state"],
    "pose_requirement": "known-poses",
    "frameworks": ["pytorch", "cuda", "custom"],
    "capabilities": ["manipulation", "policy-learning", "dynamic", "deformation", "rendering"],
    "tags": ["3dgs", "manipulation", "language", "robot-learning", "dynamic-scene"],
    "verified_date": "2026-08-30",
    "sources": [
      "https://arxiv.org/abs/2403.08321",
      "https://github.com/GuanxingLu/ManiGaussian"
    ],
    "arxiv": "2403.08321",
    "featured": false
  },
  {
    "id": "manigaussian-plus-plus",
    "name": "ManiGaussian++",
    "kind": "system",
    "category": "manipulation-interaction",
    "summary": "Bimanual manipulation agent using task-oriented Gaussians and a hierarchical leader-follower world model for multi-body dynamics.",
    "year": 2025,
    "venue": "IROS 2025",
    "paper_url": "https://arxiv.org/abs/2506.19842",
    "project_url": null,
    "code_url": "https://github.com/April-Yz/ManiGaussian_Bimanual",
    "code_status": "partial",
    "license": "MIT",
    "inputs": ["multi-view-rgb", "depth", "language", "robot-state", "simulation-state"],
    "pose_requirement": "known-poses",
    "frameworks": ["pytorch", "cuda", "custom"],
    "capabilities": ["manipulation", "policy-learning", "dynamic", "deformation", "rendering"],
    "tags": ["3dgs", "manipulation", "language", "robot-learning", "dynamic-scene"],
    "verified_date": "2026-08-30",
    "sources": [
      "https://arxiv.org/abs/2506.19842",
      "https://github.com/April-Yz/ManiGaussian_Bimanual"
    ],
    "arxiv": "2506.19842",
    "featured": false
  },
  {
    "id": "gaussiangrasper",
    "name": "GaussianGrasper",
    "kind": "system",
    "category": "manipulation-interaction",
    "summary": "Open-vocabulary robotic grasping pipeline that embeds language features into Gaussian scenes and supports scene updates after interactions.",
    "year": 2024,
    "venue": "IEEE RA-L 2024",
    "paper_url": "https://arxiv.org/abs/2403.09637",
    "project_url": null,
    "code_url": "https://github.com/MrSecant/GaussianGrasper",
    "code_status": "partial",
    "license": "unknown",
    "inputs": ["multi-view-rgb", "depth", "point-cloud", "language"],
    "pose_requirement": "external-poses",
    "frameworks": ["pytorch", "cuda", "nerfstudio", "open3d"],
    "capabilities": ["open-vocabulary", "grasping", "manipulation", "scene-editing", "rendering"],
    "tags": ["3dgs", "manipulation", "grasping", "language", "open-vocabulary"],
    "verified_date": "2026-08-30",
    "sources": [
      "https://arxiv.org/abs/2403.09637",
      "https://github.com/MrSecant/GaussianGrasper"
    ],
    "doi": "10.1109/LRA.2024.3432348",
    "arxiv": "2403.09637",
    "featured": false
  },
  {
    "id": "graspsplats",
    "name": "GraspSplats",
    "kind": "system",
    "category": "manipulation-interaction",
    "summary": "Text-queryable feature-splatting workflow for object selection, grasp sampling, Gaussian filtering, and robot-frame alignment.",
    "year": 2024,
    "venue": "arXiv 2024",
    "paper_url": "https://arxiv.org/abs/2409.02084",
    "project_url": null,
    "code_url": "https://github.com/jimazeyu/GraspSplats",
    "code_status": "partial",
    "license": "unknown",
    "inputs": ["multi-view-rgb", "point-cloud", "language", "robot-state"],
    "pose_requirement": "external-poses",
    "frameworks": ["pytorch", "cuda", "open3d", "colmap"],
    "capabilities": ["open-vocabulary", "grasping", "manipulation", "object-tracking", "rendering"],
    "tags": ["3dgs", "manipulation", "grasping", "language", "open-vocabulary"],
    "verified_date": "2026-08-30",
    "sources": [
      "https://arxiv.org/abs/2409.02084",
      "https://github.com/jimazeyu/GraspSplats"
    ],
    "arxiv": "2409.02084",
    "featured": false
  },
  {
    "id": "splat-mover",
    "name": "Splat-MOVER",
    "kind": "system",
    "category": "manipulation-interaction",
    "summary": "Multi-stage manipulation stack combining semantic and affordance Gaussians, real-time scene editing, and affordance-aligned grasp generation.",
    "year": 2024,
    "venue": "arXiv 2024",
    "paper_url": "https://arxiv.org/abs/2405.04378",
    "project_url": "https://splatmover.github.io/",
    "code_url": "https://github.com/StanfordMSL/Splat-MOVER",
    "code_status": "released",
    "license": "MIT",
    "inputs": ["multi-view-rgb", "point-cloud", "language", "robot-state"],
    "pose_requirement": "external-poses",
    "frameworks": ["pytorch", "cuda", "nerfstudio", "gsplat"],
    "capabilities": ["semantics", "open-vocabulary", "grasping", "manipulation", "affordance", "scene-editing", "rendering"],
    "tags": ["3dgs", "manipulation", "grasping", "affordance", "open-vocabulary"],
    "verified_date": "2026-08-30",
    "sources": [
      "https://arxiv.org/abs/2405.04378",
      "https://github.com/StanfordMSL/Splat-MOVER"
    ],
    "arxiv": "2405.04378",
    "featured": true
  },
  {
    "id": "robosplat",
    "name": "RoboSplat",
    "kind": "system",
    "category": "manipulation-interaction",
    "summary": "One-shot manipulation data generator that edits reconstructed Gaussians to vary objects, poses, viewpoints, appearance, lighting, and embodiments.",
    "year": 2025,
    "venue": "RSS 2025",
    "paper_url": "https://arxiv.org/abs/2504.13175",
    "project_url": "https://yangsizhe.github.io/robosplat/",
    "code_url": "https://github.com/InternRobotics/RoboSplat",
    "code_status": "partial",
    "license": "Apache-2.0",
    "inputs": ["multi-view-rgb", "robot-state"],
    "pose_requirement": "external-poses",
    "frameworks": ["pytorch", "cuda", "colmap"],
    "capabilities": ["manipulation", "policy-learning", "scene-editing", "rendering"],
    "tags": ["3dgs", "manipulation", "robot-learning", "sim-to-real"],
    "verified_date": "2026-08-30",
    "sources": [
      "https://arxiv.org/abs/2504.13175",
      "https://github.com/InternRobotics/RoboSplat"
    ],
    "arxiv": "2504.13175",
    "featured": false
  }
]
