[
  {
    "id": "wildgs-slam",
    "name": "WildGS-SLAM",
    "kind": "system",
    "category": "dynamic-scenes",
    "summary": "Monocular Gaussian SLAM that predicts uncertainty from learned features to remove dynamic distractors during tracking and mapping.",
    "year": 2025,
    "venue": "CVPR 2025",
    "paper_url": "https://arxiv.org/abs/2504.03886",
    "project_url": null,
    "code_url": "https://github.com/GradientSpaces/WildGS-SLAM",
    "code_status": "released",
    "license": "Apache-2.0",
    "inputs": ["monocular-rgb"],
    "pose_requirement": "estimated-online",
    "frameworks": ["pytorch", "cuda"],
    "capabilities": ["camera-tracking", "dense-mapping", "reconstruction", "online", "dynamic", "rendering"],
    "tags": ["3dgs", "slam", "visual-odometry", "dynamic-scene", "reconstruction"],
    "verified_date": "2026-08-30",
    "sources": [
      "https://arxiv.org/abs/2504.03886",
      "https://github.com/GradientSpaces/WildGS-SLAM"
    ],
    "arxiv": "2504.03886",
    "featured": true
  },
  {
    "id": "d4dgs-slam",
    "name": "D4DGS-SLAM",
    "kind": "system",
    "category": "dynamic-scenes",
    "summary": "Dynamic RGB-D SLAM using a temporal 4D Gaussian map and reliability-aware point filtering for camera tracking.",
    "year": 2025,
    "venue": "IROS 2025",
    "paper_url": "https://arxiv.org/abs/2504.04844",
    "project_url": "https://zhicongsun.github.io/d4dgs/",
    "code_url": "https://github.com/zhicongsun/d4dgs-slam",
    "code_status": "released",
    "license": "MIT",
    "inputs": ["rgb-d"],
    "pose_requirement": "estimated-online",
    "frameworks": ["pytorch", "cuda"],
    "capabilities": ["camera-tracking", "dense-mapping", "reconstruction", "online", "dynamic", "deformation", "rendering"],
    "tags": ["3dgs", "slam", "dynamic-scene", "reconstruction"],
    "verified_date": "2026-08-30",
    "sources": [
      "https://arxiv.org/abs/2504.04844",
      "https://github.com/zhicongsun/d4dgs-slam"
    ],
    "arxiv": "2504.04844",
    "featured": false
  },
  {
    "id": "dynamic-3d-gaussians",
    "name": "Dynamic 3D Gaussians",
    "kind": "method",
    "category": "dynamic-scenes",
    "summary": "Persistent dynamic Gaussian representation providing novel-view rendering and dense six-degree-of-freedom tracking from synchronized multi-view video.",
    "year": 2024,
    "venue": "3DV 2024",
    "paper_url": "https://arxiv.org/abs/2308.09713",
    "project_url": "https://dynamic3dgaussians.github.io/",
    "code_url": "https://github.com/JonathonLuiten/Dynamic3DGaussians",
    "code_status": "released",
    "license": "Custom; see LICENSE.md",
    "inputs": ["multi-view-rgb"],
    "pose_requirement": "known-poses",
    "frameworks": ["pytorch", "cuda"],
    "capabilities": ["object-tracking", "reconstruction", "dynamic", "deformation", "rendering"],
    "tags": ["3dgs", "dynamic-scene", "reconstruction"],
    "verified_date": "2026-08-30",
    "sources": [
      "https://arxiv.org/abs/2308.09713",
      "https://github.com/JonathonLuiten/Dynamic3DGaussians"
    ],
    "arxiv": "2308.09713",
    "featured": false
  },
  {
    "id": "gs-dynamics",
    "name": "GS-Dynamics",
    "kind": "system",
    "category": "dynamic-scenes",
    "summary": "Robot-object dynamics learner that tracks deformable Gaussians, trains a graph model, predicts future states, and supports model-based planning.",
    "year": 2024,
    "venue": "CoRL 2024",
    "paper_url": "https://arxiv.org/abs/2410.18912",
    "project_url": "https://gs-dynamics.github.io/",
    "code_url": "https://github.com/robo-alex/gs-dynamics",
    "code_status": "released",
    "license": "MIT",
    "inputs": ["multi-view-rgb", "robot-state"],
    "pose_requirement": "known-poses",
    "frameworks": ["pytorch", "cuda"],
    "capabilities": ["object-tracking", "planning", "manipulation", "policy-learning", "dynamic", "deformation", "rendering"],
    "tags": ["3dgs", "dynamic-scene", "manipulation", "robot-learning"],
    "verified_date": "2026-08-30",
    "sources": [
      "https://arxiv.org/abs/2410.18912",
      "https://github.com/robo-alex/gs-dynamics"
    ],
    "arxiv": "2410.18912",
    "featured": false
  },
  {
    "id": "fed3dgs",
    "name": "Fed3DGS",
    "kind": "method",
    "category": "dynamic-scenes",
    "summary": "Federated Gaussian reconstruction framework that distills multiple client-side scene models into a shared global representation.",
    "year": 2024,
    "venue": "arXiv 2024",
    "paper_url": "https://arxiv.org/abs/2403.11460",
    "project_url": null,
    "code_url": "https://github.com/DensoITLab/Fed3DGS",
    "code_status": "released",
    "license": "Mixed; includes upstream 3DGS license",
    "inputs": ["multi-view-rgb"],
    "pose_requirement": "external-poses",
    "frameworks": ["pytorch", "cuda", "colmap"],
    "capabilities": ["dense-mapping", "reconstruction", "multi-robot", "rendering"],
    "tags": ["3dgs", "multi-robot", "reconstruction"],
    "verified_date": "2026-08-30",
    "sources": [
      "https://arxiv.org/abs/2403.11460",
      "https://github.com/DensoITLab/Fed3DGS"
    ],
    "arxiv": "2403.11460",
    "featured": false
  }
]
